rus,eng,translations,model_translation
мы смотрели старые фильмы,we watched old movies,we watched the movies,we watched watching old movies movies
вы разгадали загадку,have you solved the mystery,you 're the expert,you're the
ты сам виноват,that's your own fault,you 're yourself,you're your your fault
пожалуйста расскажите свою историю,please go on with your story,please tell your story,please tell your story
не знаю почему,i don't know why,i do n't know why,i don't know why
не усложняй том,keep it simple tom,do n't let tom go,isn't is be tom
вы куда-то направляетесь,are you heading somewhere,are you going to miss the others,why are you heading
мы все были на вечеринке,we were all present at the party,we were all at the party,we were all at the party
том не был известен,tom was not famous,tom was n't a <unk>,tom wasn't no
том нам готовит,tom cooks for us,tom is going to cook us,tom is us us
растения чувствуют боль,can plants feel pain,the <unk> was <unk>,the ideas are
он сдал экзамен,he passed the exam,he passed the exam,he fell the examination examination
том не боится пауков,tom isn't scared of spiders,tom is n't afraid of dying,tom isn't afraid of spiders
нам нужна скорая,we need an ambulance,we need a loan,we need to
пословицы полны мудрости,proverbs are full of wisdom,the <unk> was <unk> by the hunter,the doors is is refrigerator
почему это происходило,why was that happening,why is it <unk>,why is it going
мне никто никогда не помогал,nobody ever helped me,no one helped me anything,i one helped helped
вы хорошо рассмотрели его лицо,did you get a good look at his face,did you get well his face,you you watch well well john
я хотела сделать тому больно,i wanted to hurt tom,i wanted to hurt tom,i wanted to do tom tom
мы слишком уязвимы,we're too vulnerable,we 're too slow,we're too reasonable
нам надо быть реалистами,we have to be realistic,we have to be careful,we have to be realistic realistic
во сколько вы обычно завтракаете,what time do you usually have breakfast,what time do you usually wake up,what time do you eat eat breakfast
хочешь знать кто помогал,do you want to know who helped,do you want to know who helped,do you want to know who helped
этого хватит,that'll be enough,that 's enough,this be enough
ветер дует с юга,the wind is blowing from the south,the wind was blowing with the wind,the wind is heavily
некоторые вещи никогда не меняются,some things never change,some people do n't seem to suffer,some or never never change change
боюсь я должен попрощаться,i'm afraid i must say goodbye,i 'm afraid i should get lost,i'm afraid i to say say
скоро рассветёт,day will break soon,it 'll soon be dark,it's soon
вы не принесёте мне воды,can you get me some water,would you lend me some water,you you give water water
я единственная кто выжил,i'm the only one who survived,i 'm the only one who survived,i'm the only one who
что ещё тебе надо сделать,what else do you have to do,what else do you have to do,what else do you have to
теперь тебе нужно отдохнуть,you need to rest now,you need to rest now,you you a rest rest
ты совсем из ума выжил,have you completely lost your mind,you 're completely insane,you're only of of the
не пытайтесь меня поймать,don't try to catch me,do n't make me guess,don't try to catch me
я никогда снова не влюблюсь,i will never fall in love again,i 'll never try again,i'm never single
том нарисовал эту картину,tom painted this picture,tom drew the picture,tom drew this picture
том посмеивался,tom was chuckling,tom is <unk>,tom tom
для чего я это делаю,what am i doing this for,what do i do that,what for you do this
том не шахтёр,tom isn't a miner,tom is n't a <unk>,tom isn't
мне бы хотелось бегать быстрее,i wish that i could run faster,i 'd like to run faster,i like like to faster
я совершенно согласен с вами,i strongly agree with you,i totally agree with you,i totally agree with you
я путешествую налегке,i'm traveling light,i 'm a <unk>,i'm traveling
я доволен результатами выборов,i'm pleased with the election results,i 'm satisfied with the results,i'm satisfied with the the the the the
вот почему я сюда пришёл,that's why i came here,that 's why i came here,that's why i i here here
я закончила первой,i finished first,i 'm the one who got to stay,i'm finished the
ладно идея понятна,ok i get the idea,ok is the idea,well so smell bad
тому завтра работать,tom has to work tomorrow,tom is going to work tomorrow,tom is working tomorrow tomorrow
вам не жарко,don't you feel hot,you 're not hot,aren't not hot
вы с томом,are you with tom,are you with tom,are you with tom
ледяные покровы тают,the ice sheets are melting,the <unk> was <unk> by the hunter,
том её ещё не нашёл,tom hasn't found it yet,tom has n't found it yet,tom didn't done it yet
труп тома был кремирован,tom's body has been cremated,tom 's intentions was <unk>,tom's body was been
сначала нам надо найти тома,we've got to find tom first,we have to find tom 's place,i should tom find to tom
том невозможен,tom's impossible,tom is <unk>,tom tom
её волосы мокрые от пота,her hair is wet with sweat,her hair is <unk> with anger,her hair is grown in prison
что в грузовике,what's in the truck,what 's in the boxes,what's in the
кто лучший человек для работы,who's the best person for the job,who 's looking for the kids,who the best best for for
дождь стучал в окна,the rain was beating against the windows,the rain ended in the window,the beauty is in the
моя жена разрыдалась,my wife burst into tears,my wife is <unk>,my wife wife
сколько здесь канадцев,how many canadians are here,how many students are here,how many are are here
этот зал вмещает 5000 человек,this hall can hold 5000 people,this man is a man of <unk> people,this boy is just arrested
почему ты ничего не делаешь,why aren't you doing anything,why do n't you do anything,why aren't you nothing anything
том сказал мэри его подождать,tom told mary to wait for him,tom told mary to find it,tom told mary to wait for
том снял копию,tom made a copy,tom took off his mask,tom took a comb
разве мы не друзья,aren't we friends,are n't you friends,isn't not at
ты сама не своя,you're not yourself,you 're not yourself,you you live yourself
твоя очередь это делать,it's your turn to do that,it 's your turn to do that,is your is to to
этот металл называется цинком,this metal is called zinc,this <unk> is a <unk> <unk>,this is is is
это была смешная шутка,that was a funny joke,it was a joke joke,it was a a joke
я увижу тома,i'll see tom,i 'll see tom,i'll see see tom
можете съездить туда если хотите,you can go there if you want,you can go there if you want,you can go there if you want
не двигайтесь даже не дышите,don't move don't even breathe,do n't hesitate to even wake up,don't don't even don't breathe
это был хороший знак,that was a good sign,it was a good sign,it was a good sign
я очень быстра,i'm very fast,i 'm very <unk>,i very very
я знаю что том невысокий,i know that tom is short,i know that tom is irresponsible,i know that tom is
моё пальто лёгкое но тёплое,my overcoat is light but warm,my coat is <unk> than wealth,my coat is famous to to becoming
босс накричал на меня,the boss bawled me out,the monkey is on the shelf,the shoes is at me
можно воспользоваться вашим карандашом,can i use your pencil,may i use your pencil,can i use your pencil
том стал мыть свою машину,tom started washing his car,tom has his car to his car,tom has washing his car car
это имитация,that's an imitation,that 's <unk>,this it
я рисковал всем,i risked everything,i 'm <unk> everyone,i broke all
вы знаете почему это происходит,do you know why this is happening,do you know why that 's happening,do know know why this happening
ты неправильно понял,you've misunderstood,you misunderstood,you misunderstood wrong wrong
том сделал это нарочно,tom has done that on purpose,tom did that on purpose,tom did it on purpose
ты девушка тома,are you tom's girlfriend,you 're the girl tom,are you girlfriend tom
ты рассказал тому о мэри,did you tell tom about mary,did you tell tom about mary,did you tell tom about mary
я думаю ты умнее тома,i think you're smarter than tom,i think you 're smarter than tom,i think you're smarter than tom
света недостаточно чтобы читать,there is insufficient light for reading,the <unk> wo n't be able to read,the don't are have to to a
том этого не понимает,tom doesn't understand this,tom does n't understand that,tom doesn't know that
том клянётся что он невиновен,tom swears he's innocent,tom claimed he was innocent,tom is he
он боится красивых женщин,he's intimidated by beautiful women,he is afraid of wild animals,he is most of of women
том был сердит на мэри,tom was mad at mary,tom was obsessed at mary,tom was angry with mary
я приготовлю тебе завтрак,i'll make you breakfast,i 'll make you breakfast,i'll cook you breakfast
твои полчаса почти истекли,your thirty minutes are almost up,your glass is almost ripe,your two is almost up away
ты путаешь меня с томом,you're confusing me with tom,you 're flirting with me tom,you're outdone me with tom
у тома есть брат,does tom have a brother,tom has a brother,tom has have brother brother
том нам ничего не платит,tom doesn't pay us anything,tom does n't find us anything,tom won't eat anything anything
ненавижу людей которые так говорят,i hate people who talk like that,i hate people so stupid,i hate people women women what
том сказал мне правду,tom told me the truth,tom told me the truth,tom told me the truth
я люблю приезжать в бостон,i like coming to boston,i like to visit boston,i love in boston
свидетелей не было,there were no eyewitnesses,there was no alternative,the wasn't no
мы с ней ровесники,she and i are the same age,she and i are aware of her,we and the age age
оставьте мне обед,save dinner for me,leave me lunch,leave me a
я думал что могу идти,i thought i could go,i thought i could go,i thought i could go
он сказал мне не лгать,he told me not to tell lies,he told me not to lie,he told me to to to
том не в больнице,tom isn't in the hospital,tom is n't in the hospital,tom isn't in the hospital
тебе не заменить тома,you can't replace tom,you 're not tom 's assistant,you you help tom
почему ты хочешь сделать это,why do you want to do this,why do you want to do that,why do you want to do that
я позже вам отвечу,i'll get back to you,i 'll come for you later,i'll accompany you you
певица из меня так себе,i'm not very good at singing,i 'm not the one who took that picture,good good hard of well
она у меня в кармане,it's in my pocket,she has a hole in my neck,she my my pocket
я много не ем,i don't eat much,i do n't eat much,i not a lot
кто изобрёл очки,who invented glasses,who invented the glasses,who invented glasses glasses
мы можем сейчас позвонить тому,can we call tom now,can we call tom now,we we help tom now
я готов помочь,i'm ready to help,i 'm ready to help,i'm ready to help
я был в забытьи,i was unconscious,i was horrified,i was horrified
тебе нравится твоё имя,do you like your name,do you like your name,do you your your name
у меня нет выбора,i've got no choice,i do n't have a choice,i have have choice choice
я ненавижу свой голос,i hate my voice,i hate my voice,i hate my voice
ты планируешь переезжать,do you plan on moving,do you plan to wear breakfast,do you planning on moving
как говорится любовь слепа,they say love is blind,how do you like <unk>,how does are think tom
собери всех внизу,get everybody downstairs,the rescue is downstairs,everyone's downstairs
том казался занятым,tom looked busy,tom seemed to be daydreaming,tom seemed busy busy
что это за фиолетовое пятно,what's this purple stain,what kind of rope is this,what's is of grapes
погода вчера была ужасная,the weather yesterday was horrible,the weather was awful yesterday,the weather was was haunted
как я могу вас отблагодарить,how can i thank you,how can i convince you,how can i ask you
ты сваляла дурака,you made a fool of yourself,you 're a <unk>,are you like
вы себя вели хорошо сегодня,did you behave today,you look good at yourself,did you cousins homework today
эту историю мне рассказал том,it was tom that told me this story,that story me tom,i'm sentence one one who told
том говорил с тобой,did tom talk to you,did tom speak with you,did spoke with with you
на кухне был беспорядок,the kitchen was a mess,there was a kitchen in the kitchen,the kitchen was in the the
мой брат — ветеринар,my brother is a vet,my brother is a <unk>,mine
пожалуйста не кладите трубку,hold on please,please do n't hang up the door,please don't the line
моя тётя прожила счастливую жизнь,my aunt lived a happy life,my aunt saved a life of life,my aunt also a known life life
проблема не в тебе,the problem isn't you,the problem is n't you,the problem not not
том хочет пройтись,tom wants to walk,tom wants to get drunk,tom wants to walk
она уступила место пожилой женщине,she offered her seat to an old woman,she <unk> her <unk>,she held the build to a woman
я развязала ленту,i untied the ribbon,i 'm a <unk>,i'm the notes
ты посмотрела фильм,did you watch the movie,you 're a great movie,did looked reading the movie
спасибо за фото,thanks for the photo,thanks for the <unk>,thanks for the picture
делайте уроки,do your homework,do your homework,do your homework homework
это всегда небезопасно,it's never safe,that 's always unfair,it's is always unsafe
чем ты ещё занимаешься,what else do you do,what are you doing,what're are you you do
они ушли,they left,they left,they left gone
я буду ждать вас здесь,i'll be waiting for you here,i 'll wait for you here,i'll be waiting for you
мы переночевали в бостоне,we stayed overnight in boston,we 'll stay in boston,we're in in
почему у тома столько врагов,why does tom have so many enemies,why is tom so hard,why does tom a ignorant
все этого хотят,everyone wants that,everybody wants it,everybody wants want
не уроните её,don't drop it,do n't disappoint her,don't let it
мой дядя подарил мне фотоаппарат,my uncle gave me a camera,my uncle gave me a camera,my uncle gave me a camera
наденьте ботинки,put on your shoes,put your shoes on,put on shoes on
том разгадал эту тайну,tom solved the mystery,tom <unk> the lawn,tom has coordinating this
какой ты грубый,you're so rude,which one are you,what's are clever
ваши инструкции выполняются,your instructions are being carried out,your demands are <unk>,are your are are carried
мы немедленно стали лучшими друзьями,we became best friends immediately,we became friends immediately,we immediately immediately
не забудь запереть дверь,remember to lock the door,do n't forget to lock the door,don't forget to lock the door
том заснул во время экзамена,tom fell asleep during the exam,tom fell asleep during the lecture,tom fell asleep for the the the
я принесу нам ещё вина,i'll get us some more wine,i 'll bring another more wine,i'll give us another other
почему люди целуются,why do people kiss,why do people die,why are are attentively
вы были больны,you were sick,you were sick,you were sick
я правда больна,am i really sick,i 'm really sick,i'm really really sick
вы меня поддержите,will you support me,you 're killing me,are embarrassing me
ответа ни у кого нет,no one has the answer,the sky is n't a complete,the one have one
том был под кайфом,was tom on drugs,tom was under the verge of the <unk>,tom was under
конюхи ухаживают за лошадьми,the grooms tend to the horses,the <unk> was <unk> by the hunter,what's is
возьми передышку,take a breather,take a look at yourself,take yours
вот ваш ключ,this is your key,here 's your key,here's your key key
пожалуйста не делай так больше,please don't do that again,please do n't eat so much,please don't do so more
мы приносим извинения,we apologize,we 're <unk>,we we apologize
это старая фотография,it's an old picture,this is a picture of picture,this is old picture
во сколько ты ушла,what time did you leave,what time did you go to bed,what time did you go
подожди пять минут пожалуйста,wait five minutes please,please wait fifteen minutes,wait wait three five
мне нужно немного времени,i need a little time,i need some time,i need a little time time
я позвонил домой,i called home,i called home,i called home
том выглядит грустным,tom looks sad,tom looks confused,tom looks sad
неужели всем всё равно,doesn't anyone care,everybody knows everything,is one all
я вообще ничего не видела,i saw nothing at all,i did n't see anything at all,i didn't seen all all
тома уволили за нарушение правил,tom was fired for breaking the rules,tom was fired for his behavior,tom was fired of the
пожалуйста не забудьте закрыть дверь,please don't forget to shut the door,please remember to shut the door,please don't forget to close the door
меня это всегда интересовало,i always wondered about that,i 'm always being impressed by that,it was always always
я была в библиотеке,i was in the library,i was in the library,i was in the library
автомобиль врезался в стену,the car crashed into the wall,the car hit the wall,the car rolled on the wall
моя тётя умерла от лейкемии,my aunt died of leukemia,my aunt died of the drug,my aunt died
вы можете опоздать в школу,you might be late for school,you can be late for school,you you be late school
том — превосходный гитарист,tom is an excellent guitarist,tom is a <unk> <unk>,tom is a brave guitarist
это для меня так важно,it's so important to me,it 's important to me that,it's is for for me
ты такой наивный,you're so naive,you 're so stuck,you're so so naive
как долго вы здесь уже,how long have you been here,how long have you been here,how long have you been here
ты совершенно права,you're completely right,you 're absolutely right,you're completely right
все совершают эту ошибку,everyone makes that mistake,all the students made this mistake,everyone is this mistake
я только что поужинал,i've just finished dinner,i just got married,i just just dinner
зачем ты хочешь это сделать,what do you want to do that for,why do you want to do that,why do you want to do that
не трать время,stop wasting time,do n't waste time,don't not the time
пожалейте меня,have pity on me,let me out,i'm
я капитан,i'm the captain,i 'm a captain,i'm the captain
это не совпадение,this is not a coincidence,it 's not a coincidence,this not a coincidence
как дела в школе,how are things at school,how are things in school,how are you going school school
держитесь крепко,hold on tight,hold your hair,keep warm
я устала,i'm tired now,i 'm tired,i'm tired
я разозлился,i got angry,i 'm angry,i got angry
сколько том тебе заплатил,how much did tom pay you,how much did tom pay you,how much did tom pay you
том с мэри не пострадали,tom and mary weren't injured,tom and mary are n't <unk>,tom and mary at invited
том действительно любит мэри,tom does love mary,tom loves mary likes,tom tom loves mary mary
нам нужно завершить начатое,we need to finish what we've started,we need to build out the tax,we need to finish it started started
том - мужчина средних лет,tom is a middle-aged man,tom is a man of old words,tom is a strong years
я усвоил урок,i've learned my lesson,i 'm learning my lesson,i'm learned a lesson
до бостона от чикаго далеко,boston is a long way from chicago,it 's far from boston from the hospital,it's is to near school
пожалуйста будьте внимательны переходя улицу,please be careful when crossing the street,please be careful by lightning,please be be when to the
том признал что украл деньги,tom admitted that he stole the money,tom admitted he was stolen money,tom admitted he i wrote he
том и на кларнете играет,tom also plays clarinet,tom is playing his piano,tom and watches with baseball
это крайне сложный вопрос,that's a very difficult question,that 's a difficult question,this is quite complicated question question
я пошёл в парк,i went to the park,i went to the park,i went to the park
нет подарка ценнее чем доверие,no gift is more precious than trust,there 's no way to tell the others,there's more more more than
чуешь запах газа,do you smell gas,the <unk> is <unk>,the gas is
том прячется в гараже,tom is hiding in the garage,tom is hiding in the garage,tom is hiding in the garage
том едет в австралию,tom is on his way to australia,tom is going to australia,tom is on in australia australia
том довольно старый,tom is quite old,tom is quite old,tom is quite attractive
какая твоя любимая ролевая игра,what's your favorite role-playing game,what 's your favorite game game,what's your favorite plan
это дом тома,it's tom's house,this house is tom 's,is tom's tom's house
посмотрите пожалуйста кто там пришёл,please see who is at the door,please look at there,look at them there there
он склонен опаздывать,he is apt to be late,he tends to be late,he is to be late
я думал ты любишь тома,i thought you loved tom,i thought you loved tom,i thought you loved loved
хочешь попробовать это,do you want to try this,do you want to try it,do you want to try it
не выбрасывай это,don't throw it out,do n't buy that,don't throw it down
я хочу сходить туда один,i want to go there alone,i want to go there alone,i want to go there alone
том был моим первым начальником,tom was my first boss,tom was my first boss,tom was my first age
мы не хотим этого,we don't want that,we do n't want that,we don't want to
учитель сердито отчитал своих учеников,the teacher scolded his students severely,the teacher teacher his teacher by a bear,the teacher directs officially his its its students
вы сегодня вечером работаете,are you working tonight,are you working tonight,are you working today today
вам правда нравится это делать,do you really like to do that,do you really like doing that,do you really like do that that
тебе больно,are you in pain,you 've got a pain,you you hurt
